<!ELEMENT SYSTEM (MODULES,GROUPS_MENU,ATTRIBUTES,GROUPS_ATTRIBUTES,TABLES,ACTIONS,REPORTS,FORMS)>
<!ATTLIST SYSTEM id NMTOKEN #REQUIRED>
<!ATTLIST SYSTEM name CDATA #REQUIRED>
<!ELEMENT MODULES (MODULE)>
<!ATTLIST MODULES id NMTOKEN #REQUIRED>
<!ATTLIST MODULES name NMTOKEN #REQUIRED>
<!ELEMENT MODULE EMPTY>
<!ATTLIST MODULE id NMTOKEN #REQUIRED>
<!ATTLIST MODULE name CDATA #REQUIRED>
<!ATTLIST MODULE menu NMTOKEN #REQUIRED>
<!ELEMENT GROUPS_MENU (MENU)>
<!ATTLIST GROUPS_MENU name CDATA #REQUIRED>
<!ELEMENT MENU (MENU*,MI*,COMMENT*)>
<!ATTLIST MENU id NMTOKEN #IMPLIED>
<!ATTLIST MENU name CDATA #IMPLIED>
<!ELEMENT MI EMPTY>
<!ATTLIST MI name CDATA #IMPLIED>
<!ATTLIST MI type CDATA #IMPLIED>
<!ATTLIST MI formlist NMTOKEN #IMPLIED>
<!ATTLIST MI actionlist CDATA #IMPLIED>
<!ELEMENT COMMENT EMPTY>
<!ATTLIST COMMENT name CDATA #REQUIRED>
<!ELEMENT ATTRIBUTES (A+,COMMENT+)?>
<!ATTLIST ATTRIBUTES name NMTOKEN #REQUIRED>
<!ELEMENT A (AI*)>
<!ATTLIST A id NMTOKEN #REQUIRED>
<!ATTLIST A name CDATA #IMPLIED>
<!ATTLIST A caption CDATA #IMPLIED>
<!ATTLIST A type (boolean|date|int|list|number|ref|string|text) #IMPLIED>
<!ATTLIST A table NMTOKEN #IMPLIED><!ATTLIST A ret (AGENT2_ID_ret|CODE|GEO_TERR_ID_ret|ID|NAME|YEAR) #IMPLIED>
<!ATTLIST A form NMTOKEN #IMPLIED>
<!ATTLIST A nulls CDATA #IMPLIED>
<!ATTLIST A labelwidth NMTOKEN #IMPLIED>
<!ATTLIST A where CDATA #IMPLIED>
<!ATTLIST A len (10|11|12|13|14|18.4|18.2|2|20|3|3.1|34|4|8|80|9) #IMPLIED>
<!ATTLIST A formula CDATA #IMPLIED><!ATTLIST A local (true) #IMPLIED>
<!ATTLIST A readonly (false|true) #IMPLIED>
<!ATTLIST A array (false|true) #IMPLIED>
<!ATTLIST A virtual (true) #IMPLIED>
<!ATTLIST A visible (false|form|grid|true) #IMPLIED><!ATTLIST A width (100|20|25|30|33|34|35|40|50|60|65|70) #IMPLIED><!ATTLIST A pid NMTOKEN #IMPLIED><!ATTLIST A parentkey (cascade|nocascade) #IMPLIED><!ATTLIST A query CDATA #IMPLIED><!ATTLIST A value CDATA #IMPLIED><!ATTLIST A button (email|true|web) #IMPLIED><!ATTLIST A format CDATA #IMPLIED><!ELEMENT AI EMPTY><!ATTLIST AI id CDATA #REQUIRED><!ATTLIST AI name CDATA #IMPLIED><!ATTLIST AI readonly NMTOKEN #IMPLIED><!ELEMENT GROUPS_ATTRIBUTES (COMMENT+,GA+)?><!ATTLIST GROUPS_ATTRIBUTES name CDATA #REQUIRED><!ELEMENT GA (A*,GA*)><!ATTLIST GA id (AgentAddr|BKD_CODE_GR|BKD_VID_KDB|CONTROL_ORG|DEBIT|DEBITOR|DictionaryBC|DictionaryNote|DictionaryParam|Document|DocumentAutoNumb|DocumentAutoNumbP|DocumentP|ENF_DOC|ENF_PROC|GeoParam|INCOM_SUB_VID_KDB|ParamAddr|SubjectRF|YEAR_BUDGET) #IMPLIED><!ATTLIST GA name CDATA #IMPLIED><!ATTLIST GA caption CDATA #IMPLIED><!ATTLIST GA width NMTOKEN #IMPLIED><!ELEMENT TABLES (TABLE*,COMMENT*)><!ATTLIST TABLES name NMTOKEN #REQUIRED><!ELEMENT TABLE (A*,TI*,GA*,TABS?,COMMENT?)><!ATTLIST TABLE id ID #REQUIRED><!ATTLIST TABLE name CDATA #REQUIRED><!ATTLIST TABLE order CDATA #IMPLIED><!ATTLIST TABLE hid (CODE|IDX|NAME) #IMPLIED><!ATTLIST TABLE tablename (AGENT|AGENT_ACC|AGENT_ADDR|AGENT_PERSONS|DICNOMNS) #IMPLIED><!ATTLIST TABLE virtual NMTOKEN #IMPLIED><!ATTLIST TABLE where CDATA #IMPLIED><!ATTLIST TABLE caption CDATA #IMPLIED><!ELEMENT TI EMPTY><!ATTLIST TI unique CDATA #REQUIRED><!ATTLIST TI id ID #IMPLIED><!ATTLIST TI name CDATA #IMPLIED><!ELEMENT TABS (TAB+)><!ATTLIST TABS name CDATA #IMPLIED> <!ELEMENT TAB (A*,GA*,COMMENT?,GRID*,TABS?)><!ATTLIST TAB name CDATA #REQUIRED><!ATTLIST TAB id NMTOKEN #IMPLIED><!ELEMENT ACTIONS (ACTION*,COMMENT*,MI*)><!ATTLIST ACTIONS name NMTOKEN #REQUIRED><!ELEMENT ACTION (P*,FORM?)><!ATTLIST ACTION id ID #REQUIRED><!ATTLIST ACTION name CDATA #REQUIRED><!ATTLIST ACTION type (link|procedure|script) #REQUIRED><!ATTLIST ACTION href CDATA #IMPLIED><!ATTLIST ACTION visible NMTOKEN #IMPLIED><!ATTLIST ACTION actionlist CDATA #IMPLIED><!ATTLIST ACTION refresh (all) #IMPLIED><!ATTLIST ACTION procedure NMTOKEN #IMPLIED><!ELEMENT P EMPTY><!ATTLIST P id (convname|errorone|handbookname|val) #REQUIRED><!ATTLIST P value CDATA #REQUIRED><!ELEMENT FORM (A*,GA*,GRID*,TABS?)><!ATTLIST FORM name CDATA #IMPLIED><!ATTLIST FORM id ID #IMPLIED><!ELEMENT REPORTS EMPTY><!ATTLIST REPORTS name NMTOKEN #REQUIRED><!ELEMENT FORMS (COMMENT*,FORM*)><!ATTLIST FORMS id NMTOKEN #REQUIRED><!ATTLIST FORMS name NMTOKEN #REQUIRED><!ELEMENT GRID (MENU?)><!ATTLIST GRID id NMTOKEN #IMPLIED><!ATTLIST GRID name CDATA #REQUIRED><!ATTLIST GRID table NMTOKEN #REQUIRED><!ATTLIST GRID readonly (false|true) #IMPLIED>
<!ATTLIST AI actionlist NMTOKEN #IMPLIED>
<!ATTLIST GRID actionlist CDATA #IMPLIED>